<?xml version="1.0" encoding="utf-8"?>
<history xmlns="mediateka"
   xmlns:xsi="http://www.w3.org/2001/XMLSchema-instance"
   xsi:schemaLocation="mediateka history.xsd" autoIndex="4">
   <record recordID="1">
		<discID>1</discID>
		<personID>1</personID>
		<comment>qwerty</comment>
		<dateOfIssue>2011-01-01</dateOfIssue>
		<dateOfReturn>2011-02-01</dateOfReturn>
		<promisingDate>2011-01-12</promisingDate>
	</record>
	<record recordID="2">
		<discID>3</discID>
		<personID>2</personID>
		<comment>qwerty</comment>
		<dateOfIssue>2011-01-01</dateOfIssue>
		<dateOfReturn>2011-02-01</dateOfReturn>
		<promisingDate>2011-02-01</promisingDate>
	</record>
	<record recordID="3">
		<discID>2</discID>
		<personID>3</personID>
		<comment>qwerty</comment>
		<dateOfIssue>2011-01-01</dateOfIssue>
		<dateOfReturn>2011-02-01</dateOfReturn>
		<promisingDate>2011-02-01</promisingDate>
	</record>
</history>



